{
  "model": "Qwen/Qwen2.5-7B",
  "peak_layer": 17,
  "ex_dim": 350,
  "n_boot": 30,
  "boot_rhos": [
    0.21609147595704317,
    0.2170312320269396,
    0.21605425789843533,
    0.22141313395208886,
    0.2679064625815797,
    0.2664618886558542,
    0.21450266947086188,
    0.2696638276116286,
    0.26972693938093095,
    0.21480198632902434,
    0.2688025096792872,
    0.2643889445271429,
    0.2164230562939613,
    0.23350476194599312,
    0.2160667477317165,
    0.2156173100064332,
    0.2177235887680406,
    0.26807732097871756,
    0.26685359262656644,
    0.21653952593653084,
    0.2349406632417464,
    0.22876116853892678,
    0.2661103597991509,
    0.21465024406403752,
    0.21458507675791771,
    0.222503643715109,
    0.2162057199664971,
    0.266728848969425,
    0.2655335479851243,
    0.24597706193905863
  ],
  "mean": 0.23778825224452568,
  "std": 0.02348151659038532,
  "ci_95": [
    0.21456241475397736,
    0.26968118334818675
  ],
  "design": {
    "probe_seed": 42,
    "note": "Probe seed fixed across all bootstrap iterations to isolate split variance from seed variance. Seed variance is measured separately by the 7-seed protocol in the main experiments."
  },
  "provenance": {
    "model_revision": "d149729398750b98c0af14eb82c78cfe92750796",
    "script": "scripts/split_bootstrap_gpu.py",
    "timestamp": "2026-04-13T00:49:18+00:00",
    "value_source": "post_hoc_deterministic",
    "device": "cuda"
  }
}